1,ａｉｔ是很敏感的建築物
1,剛詢問了一下
1,剩下三年的時間
1,剩這麼多，準備太多啦
1,副市長能夠留下來
1,副組長可考慮由各方代表擔任
1,副組長多一點
1,副組長的名額如果有五個
1,創作藝術品的精神
1,創新創業政策
1,創新才是台灣未來生存的機會
1,創新法規沙盒平台
1,創立社會企業
1,創辦人將分享
1,創造了一個很好的成績
1,創造優質生活環境
1,創造適當環境
1,功能到底是如何
1,功能當然不限於看預算
1,功課都做完後
1,加上不施肥、不撒農藥的自然農法
1,加了一盎司咖啡的一杯牛奶
1,加以討論做成決議
1,加你好友還在等待中
1,加入全球議題的價值同盟
1,加強交通工程建設
1,加強保護少年
1,加強和全球及區域的連結
1,加強城市外交
1,加強學生安全管理
1,加強推動照明改善工作
1,加強這一部分的宣導
1,加強都市更新
1,加快產業轉型升級
1,加拿大、西班牙、丹麥、新加坡各地
1,加班加到死
1,加班費漏給
1,加給的部份
1,加速公共藝術設置進度
1,加速醫療院所工程
1,努力不一定會成功，可是不努力一定很輕鬆
1,努力尋找正職機會
1,努力想做好那份工作
1,努力打聽哪裡還有新的機會
1,努力賺錢
1,勇敢地走出另外一條路
1,勇敢的臺灣人
1,動彈不得
1,動態式的後端
1,務實可靠的工程師文化
1,務必配合辦理下述事項
1,勞你費心了
1,勞保局提醒
1,勞動底層
1,勞工之薪資
1,勞工與企業雙贏的天龍國
1,勤勞和工作效率
1,勤崴國際為了更新電子地圖
1,勸他搬到鄉下一起住
1,勸君莫惜情侶衣
1,包含了完美的一切技術細節
1,包含幾個關鍵元素
1,包括取消參與社團課程
1,包括國立中央圖書館、圓山、凱悅等地
1,包括所有的網路申報
1,包括美國、日本、歐洲在內
1,北大荒水餃好大顆
1,北市就服處臺北青年職涯發展中心
1,北投就業服務站
1,北海道哈密瓜真的不怎麼樣
1,北海道拉麵是偏重鹽味
1,北部濱海公路所見
1,匯款後遭詐騙集團已讀不回
1,區公所會於計畫書內回應
1,區域發展及環境永續
1,區域的和平穩定發展
1,區域的和平穩定與發展
1,區域的情勢快速變動
1,區塊鏈是今年最火熱的科技趨勢了
1,十二月會進行第一次的系統驗證
1,十分不舒服
1,十分堅持住三四天
1,十分意外卻沒人回應
1,十分瞧不起他
1,十分緊張
1,十分鐘
1,十分鐘只像是一扎眼
1,十字樓將近一年整修
1,十字路口的生命如此脆弱
1,十年前一起睡過校門口
1,十年前跟一起睡過校門口
1,十年樹木，百年樹人，千年樹妖
1,十年生死兩茫茫，風吹早低見牛羊
1,十年說起來很長
1,十幾年來的研究成果
1,十點半以前不足七人
1,千年傳統全新感受
1,千萬不要再錯過
1,千萬不要浪費四年的時間
1,千萬不要跟錢過不去
1,千萬不要點進去喔
1,千里之行，死於胯下
1,千金難買早知道，我要回家去睡覺
1,千金難買蚤不到
1,午後的河岸
1,午餐吃什麼
1,午餐時天氣超好
1,半個月就不去了
1,半小時後我回報
1,卑南語
1,卑南語、賽夏語
1,協作會議等民主創新的機制
1,協作確實可以帶來成果
1,協助二度就業母親
1,協助口頭承租農地之耕作者
1,協助執行秘書督導各組作業
1,協助婦女再就業
1,協助安排裝機
1,協商和交流互動的成果
1,協會拿到許可函後
1,協會的宗旨是社會福利服務
1,南勢角下車，北市郝龍斌
1,南拳媽媽，女權爸爸
1,南無戰鬥陀螺
1,南部現在應該天氣很熱吧？
1,卡得呱呱叫
1,卡得好！
1,卡那卡那富語
1,卡那卡那富語、茂林魯凱語
1,即使不眠不休的工作
1,即使你這樣想
1,即使免費服務
1,即使是文創也要放入新的元素
1,即使自身這邊算是是順性別者
1,即可決定是否核准
1,即宣示有共識的部分
1,即時提供防汛資訊
1,卸任十五天前
1,卻也衣食無慮
1,卻又無法說出口
1,卻接到爸爸打來的電話
1,卻是要以抽象化的象徵手法
1,厚度大概一公分吧
1,原住民族也在變
1,原住民族基本法
1,原住民族的小朋友
1,原來信用卡也可以當載具
1,原來可以抵用
1,原來可以預約呀
1,原來在臨界條件下
1,原來如此啊
1,原來寒暄都是用謠言
1,原來是個擅長挖坑的朋友呀
1,原來是用中藥材的名義進口的
1,原來會記錄你的開信習慣
1,原來有一堆人都在樓下餐廳吃
1,原來有兩個大樓
1,原來直播是假的
1,原來舊金山遊行破百萬很多年了
1,原來謠言源自南非一家公司
1,原來貼了新聞沒事
1,原來這個圈圈是這個名字
1,原來這裡可以閒聊
1,原來黑洞的照片這麼難拍起來
1,原先是認為不要再大興土木
1,原則上作到這些步驟
1,原則上是以個人資格來邀請
1,原因剛好是
1,原契約所定價格
1,原始語料可以自己抓
1,原始面貌
1,原料的品質便馬虎不得
1,原本一間會遵守新聞道德的媒體公司
1,原本去做甜點欸
1,原本家人都不相信
1,原本是旗下轉投資
1,原本組織內成員也會改變工作內容
1,原本耳機只能跟發射器配對
1,原訂五十分的車
1,原訂戶申請復機
1,厲害的原因是
1,去上次去過那家餐廳好了
1,去便利商店買濾掛式咖啡
1,去做天下所有事
1,去剛剛的金庫那邊等車
1,去小樽的列車
1,去年不是換電瓶
1,去年十月
1,去年已經收到天災補助款
1,去年起進駐超商通路
1,去年都銷售一空
1,去捍衛民主自由的生活方式
1,去摘一株最大最金黃的麥穗
1,去札幌啤酒博物館
1,去機場寄行李
1,去洗溫泉
1,去當代藝術館看展覽
1,去看白鬍鬚瀑布
1,去美國參加兒子的畢業典禮
1,去花蓮騎腳踏車
1,去買咖啡的時候
1,去那邊也沒看到
1,去開放讓大家重製
1,去青池看點燈
1,參加人數
1,參加會議的人是一百二十人
1,參加當地的加速計劃
1,參加的社會保險
1,參加紐西蘭政府舉辦的加速計劃
1,參展團隊簡介
1,參考大廠設計
1,參與的經過
1,參與者也可以看到不同意見者
1,參觀須知
1,參閱書面資料
1,又來一隻
1,又回去買了兩包
1,又國際會議中心的花費很貴
1,又如說有傳言
1,又是一個付費的全民公測
1,又是令人瑟瑟發抖的一天
1,又有誰會來紀錄呢
1,又省掉一堆錢
1,又看了兩本也很有興趣的書
1,又能充份運用股權的設計
1,又被騙了
1,又要賺大錢囉
1,又讓人的價值找到新的定位
1,又讓你胃食道逆流了嗎？
1,又跑去買冰淇淋三明治
1,又送兩杯咖啡
1,又香又甜
1,叉路口的涼亭
1,及人權的普世價值
1,及兩岸關係
1,及其他相關法律
1,及動態設計
1,及國民健康
1,及本市諮詢中心人員
1,及營業稅等等
1,及相關說明修改
1,友邦的元首與貴賓
1,反恐合作
1,反映心聲
1,反正你也有很多事情要作
1,反正孫女也出生了
1,反正，愛，我是肯定給不了的
1,反正這件事情還不急
1,反而不利於語言復育
1,反而需要比較精準的法律說明
1,叔叔親了我媽媽
1,取代就越來越快
1,取得使用執照後不得再次施工
1,取得使用執照後不能做二次施工
1,取得有效之工作證明
1,取得綠建築標章
1,取得認證標章
1,取得領導地位
1,受紐西蘭政府之邀
1,古典音樂
1,古道梅子綠茶，附近地方媽媽
1,古道西風瘦馬，斷腸卡納赫拉
1,句首句尾的標點
1,另一方面另行謀職
1,另一派之看法
1,另一頭有人露出一樣的笑容
1,另一類標準則為
1,另外今天林里長也有出席
1,另外在長期照顧的議題上
1,另外寫了一張海報
1,另外要特別向各位委員致歉
1,另外這種藥水他不會傷胃
1,只不過是個過客
1,只剩下十分鐘了
1,只剩下幾分鐘
1,只剩哭泣聲
1,只吃了布丁
1,只好跟風
1,只從別人那裡拿走自己想要的東西
1,只提到空間、時間
1,只是一塊易碎的玻璃罷了
1,只是加了含量不曉得有多少的咖啡
1,只是大家都不願意去面對
1,只是徒步的距離通常會被騙
1,只是成就上位者的一點點薄弱的光環
1,只是教練還是在訓話
1,只是既得利益者是誰
1,只是有點擔心你們
1,只是現在身分變成局長
1,只是略盡棉薄之力
1,只是當橡皮圖章
1,只是看到的差別而已？
1,只是站著沉默不語
1,只是臃腫的科層架構
1,只是被無限放大
1,只是要有一個連結在那邊
1,只是走路而已
1,只是遇到亂流而已
1,只會一直拋問題
1,只會針對商家
1,只有一種人我絕對不會給他半毛錢
1,只有一節車廂超滿載
1,只有不會教的父母和老師
1,只有叢生的雜草
1,只有好比像千分之三的人來
1,只有我一個沒有辦法
1,只有無聲的淚
1,只有第一次會有真人問問題
1,只有等到掠奪者變成了被掠奪的對象時
1,只有等到變成了被掠奪的對象時
1,只有腦力和腳力
1,只有距離沒有遠傳
1,只有遠傳沒有訊號
1,只有雷聲和雨聲
1,只準官員二奶，不準百姓嫖娼
1,只留畫面上最重要的訊息
1,只聽得懂法官跟書記官說話
1,只能寫在這本筆記本裡
1,只能擁抱小卻幸
1,只能自己用
1,只能說選舉是個綜合技
1,只能靠自己長途跋涉
1,只花了兩天就搞定了升級
1,只要做出成績
1,只要出問題
1,只要別人理解你的人生
1,只要唸出網站的文字敘述
1,只要大家同心協力
1,只要好好活著就夠了
1,只要它不要涉及懲罰
1,只要懷疑天氣預報的時候
1,只要我們相信
1,只要拿出成績
1,只要是不安全性行為
1,只要是花生醬吐司
1,只要有五千人連署
1,只要有暖氣
1,只要牽著對方的手
1,只要稍微注意新聞報導
1,只要那個人沒有允許
1,只要面積夠大都可以來
1,叫一堆人來排排坐
1,叫了一隻一起吃
1,叫了等於浪費
1,叫他起來
1,叫你媽媽帶你去買玩具啊
1,叫來等於浪費
1,叫做天佑花蓮
1,叫大兒子代替她去一天
1,叫天天不應，叫哥哥布林
1,叫媽媽去買票
1,叫我抽血檢查看看
1,叫濃湯就對了
1,召開一般程序審查會議
1,可上台北就業大補帖查詢
1,可不可以承載這麼長時間的連結
1,可不可以都別出門
1,可享二十元優惠
1,可以不受法律拘束地盡情實驗
1,可以不用這麼急吧
1,可以互相合作的地方在那裡
1,可以再次表達意見
1,可以再給中心一個禮拜的時間
1,可以分為簡單版及完整版
1,可以協助處理
1,可以去尋找另一個地方
1,可以參考我們提出的綱要
1,可以回應社會與經濟問題
1,可以多數碾壓
1,可以多賺一些
1,可以天天看正妹啦！
1,可以寫字又畫笑臉
1,可以幫上忙
1,可以幫我抓一張圖嗎？
1,可以找爸爸商量
1,可以搬出去住了
1,可以更進步
1,可以溝通出解決方法
1,可以溝通就直接溝通
1,可以用無線的耳機方式來聽歌
1,可以盡情實驗
1,可以省一筆錢
1,可以看出明顯轉變的痕跡
1,可以聽見很多正常家庭的對話
1,可以訓練一個機器人
1,可以變成有線耳機
1,可以讓我看見
1,可以貼在手機殼後面
1,可以走出創痛
1,可以超音速飛行
1,可以透過文字來記錄生活點滴
1,可以隨時掌握紀錄取得時效
1,可作為一個分組討論的場地
1,可來函表示
1,可借鏡的策略與競爭力
1,可允許設立符合使命之公司
1,可分配樓地板面積
1,可參考第二十二條規定
1,可可拿鐵，可可拿不動
1,可可拿鐵，可可覺得重
1,可否今天先進行討論
1,可否使他們有發言的機會？
1,可否請有此想法之人具體說明
1,可幫助改善酸性體質
1,可循行政程序法等相關規定
1,可怕的的是數字還不只這樣
1,可怖嗚呼哀哉
1,可怖嗚呼哀哉～
1,可惜不能玩空拍機
1,可惡好羨慕喔
1,可惡接關失敗
1,可撥打諮詢專線
1,可是不行
1,可是他昨天還有吭聲
1,可是很甜脆哦！
1,可是我要加辣辣
1,可是發票我都存手機條碼載具
1,可是自己沒有空的人
1,可是要長達十小時就不行了
1,可是錢從哪裡來？
1,可減少癌細胞的產生
1,可能只是自己一時沖昏頭
1,可能就會認為我們講得不夠白話
1,可能我們的許多產業
1,可能是身邊認識的人
1,可能會失去工作
1,可能會引起媒體或民意的反彈
1,可能會引起腸胃不適
1,可能會成為政治人物
1,可能要再多做溝通
1,可能還會前後搖晃
1,可行性已經有進行評估
1,可行性較高
1,可變現資產
1,可負載嗎？
1,台上講者分享事業經驗
1,台中市南屯區萬和路
1,台北創新中心
1,台北去年有破十萬人
1,台北國語學校
1,台北市也會停電
1,台北市具有高度人文氣息
1,台北市南港區研究院路二段一二八號
1,台北市國際會議中心
1,台北市文山區木新路
1,台北市是政經決策中樞
1,台北市的計程車好可怕
1,台北市蘊藏著無限的潛力與生機
1,台北很冷嗎？
1,台北數位產業園區於六月底正式營運
1,台北時尚產業園區
1,台北東區商圈現在都變一堆特賣會了
1,台北東區特賣會商圈
1,台北洋畫研究會
1,台北火車站大廳
1,台南超好逛又好吃
1,台水不是資本主義邏輯
1,台水公司現有八十位師傅
1,台澎金馬自由中國地區
1,台灣一直持續向上
1,台灣中部山景
1,台灣再不加點油
1,台灣只有開一家而已
1,台灣各個企業
1,台灣各個企業和政府機關
1,台灣國際藝術節
1,台灣在那個年代
1,台灣地方經濟
1,台灣微笑標章
1,台灣是否有穿上黃背心的年代？
1,台灣的天才跨性別駭客
1,台灣被資方綁架這麼深
1,台灣還蠻多企業都不看學歷了！
1,台電有自己的核能月刊
1,台電林口電廠點火順利
1,史觀可以粗淺的來說
1,右邊是三峽溪與拱橋
1,司改會議
1,司機不知道我在哪
1,司機向車內的人廣播
1,司法已經失去人民的信任
1,司法必須回應人民的需求
1,司法改革
1,司法歸司法
1,司法無法親近人民
1,吃了布丁肚子咕嚕叫
1,吃什麼啊？
1,吃咖哩烤餅
1,吃完所有食物之後才能煮粥
1,吃完晚餐再走吧
1,吃完飯後差點忘了
1,吃完麵後跟服務生要調淡的白湯
1,吃葡萄不吐葡萄皮，倒吃葡萄倒吐葡萄皮
1,吃飯記得拿收據，要報誤餐費
1,吃麵麵不加辣辣
1,各位之後還有收到通知
1,各位任期也是四年
1,各位先進、各位委員
1,各位前輩、各位同仁
1,各位同學先進好
1,各位國人同胞
1,各位委員還有無其他意見
1,各位家長
1,各位對組成與成員有何高見？
1,各位小朋友
1,各位旅客請繫好你的安全帶
1,各位親愛的臺灣人民
1,各位還有其他意見
1,各位開車的同學小心
1,各國都拍攝的非常的多
1,各國駐臺使節及代表
1,各方意見及相關資料
1,各會員國應秉持善意
1,各機關都在市府行政大樓
1,各界不同之意見
1,各界出席的人員的比例
1,各系統經營者
1,各階段的必經過程
1,合乎特殊情形及需求
1,合理的部分
1,合計未達五百平方公尺
1,同事運用開源素材
1,同學生日快樂
1,同學都不會對老師那麼殘忍
1,同學霸凌
1,同安市場
1,同性別之監護人
1,同性性傾向
1,同性戀的權利
1,同性結婚權
1,同意、不同意、略過三個選項
1,同時連線的人數不太是問題
1,同樣可以配合這個概念
1,同樣設置了許願池
1,同運人士騙人
1,名額有限，敬請把握
1,向三峽區公所提出意見
1,向來都是信件溝通
1,向文化局申請
1,向本單位提出
1,向村裡的人借錢
1,向鄰居打聲招呼後回家了
1,向鄰居親戚借錢
1,否則予以廢止
1,否則在二十天內採取法律行動
1,否則採取法律行動
1,含主建物及附屬建物
1,吸引人才並留住人才
1,吸引國內外青年實現夢想
1,吸引高達四百多萬人參與
1,吸食著迷妄自我的毒品
1,呈現特殊景觀
1,呈現稍微擁擠的狀況時
1,告別以往
1,告訴他們自己的故事
1,告訴我你叫什麼名字
1,告訴自己相信自己
1,味噌湯一開鍋蓋
1,味噌、醬油這三種風味
1,味增炒牛舌
1,味道才夠
1,呵呵！
1,呼籲所有朋友提高警覺
1,和一個合適的抬頭
1,和區域中許多國家
1,和區域內的成員
1,和區域成員廣泛交流合作
1,和半年收入的比值
1,和各種宗教一起說謊
1,和在地經濟緊密連結
1,和媽媽一起準備晚餐
1,和對岸就相關議題
1,和尚端湯上塔
1,和平的堅定維護者
1,和平的積極溝通者
1,和平、自由、民主
1,和年金改革一樣
1,和是否符合規定
1,和朋友邊聊天
1,和真正的黑客不同
1,和睦相處
1,和老家完全不一樣
1,和肚子裡有沒有食物沒有關係
1,咖啡加上點心
1,咖啡味的牛奶？
1,咖啡好喝，點心也很好吃
1,咖啡拿鐵這個詞彙
1,咖啡測試
1,咖啡牛奶聽起來，應該本體是牛奶
1,咬到辣椒有夠辣
1,品質不錯
1,品質不錯，去年都銷售一空
1,哇我上大螢幕了
1,哈哈哈，對
1,哈根達斯最好吃的口味是草莓
1,哎呀被發現！
1,員工休息區變得這麼好
1,員工感覺上都是以外來移民居多
1,哪來的照片？
1,哪來的麥克風
1,哪來那麼多智者
1,哪天才能放心的哭泣
1,哭泣的流轉的眼神
1,哲學是一場搏鬥
1,唐吉柯德和大創
1,唯有內心充滿光明，才能消滅一切的黑暗
1,唯有成立服務辦公室
1,唯有激發新的成長動能
1,唯有讓法律系統與時俱進
1,商人屯好貨
1,商人選邊是還蠻正常的
1,商業登記
1,啊～
1,啊不就是
1,啊～不要閃開～不
1,啊！就這樣喔
1,問君能有幾多愁，兵長只有一米六
1,問君能有幾多愁，恰似一群八九跳陣頭
1,問君能有幾多愁，給我來瓶二鍋頭
1,問問看站員
1,問店員「拿鐵咖啡」跟「牛奶咖啡」有什麼不一樣？
1,問過身邊的人
1,問過身邊的人沒一個有聽過的
1,問題應該還好
1,啟發了我的興趣
1,善有善報，早有早報，時候已到，沒有晚報
1,善有善報，星有星爆
1,善有善報，星有星爆。不是不報，十秒未到
1,喊著不要殺我
1,喊著什麼不要殺我
1,喔唷
1,喔喔原來是政府的新聞稿才行
1,喔喔喔
1,喔喔，那大概不能拿來用惹
1,喜歡好好用型別來描述結構
1,喜歡就好
1,喜歡纏著阿公
1,喜歡說故事的人
1,喜滋滋
1,喝久了小七的咖啡
1,喝咖啡吃巧克力
1,喝咖啡、吃甜食
1,喝咖啡當早餐
1,喪失對於未來的自主權
1,喪失投票權
1,單位中文名詞
1,單價會越來越低
1,單子上寫的地址根本不存在
1,單純只是想用英國研究
1,單純閱讀訊息無中毒風險
1,嗆了一聲
1,嗆了一聲鄉民都沒見過世面
1,嗨我在這
1,嗯、啊、欸。大家辛苦了
1,嘗試了無數次
1,嘲笑人並不會讓你的地位比人更高一點
1,嘴裡說著不要，身體卻很誠實
1,嘻嘻哈哈，嘻嘻不好笑
1,噴火龍，噴射火焰！
1,噶瑪蘭語
1,嚇了一大跳
1,嚴密防範非洲疫情
1,嚴重的災情以及人命的傷亡
1,四個小孩外出買東西
1,四包暖暖包都用上了
1,四名公民黑客
1,四季春加奶清爽許多
1,四季春戚風蛋糕
1,四年級的綜合活動
1,四月是你的謊言，武漢是你的肺炎
1,四百多位精神科醫師也發表公開聲明
1,四百萬年以來
1,四處結交志同道合的朋友
1,回來帶小孩吧
1,回到一二號巴士站
1,回到家又心血來潮寫了一篇文
1,回到家大概七點多吧
1,回去就打烊了
1,回去幫助大家
1,回去會詢問了解狀況
1,回去都十一點了
1,回家之後可以按時服用
1,回家啦，我要關門了
1,回家後才開始煮飯
1,回家時經過菜市場
1,回憶時甜蜜的滋味
1,回我的家鄉看看
1,回旅館沒有發現我的帽子
1,回程我兒子一直喊腳酸
1,回程要坐在左側
1,回鄉下外公家住
1,回頭來看
1,回飯店大致整理一下東西
1,因受誣告而被送上斷頭臺
1,因各有立場
1,因大聲對學生咆嘯
1,因應外在經濟的變化和風險
1,因應趨勢與需求
1,因此
1,因此不只有中央需要努力
1,因此他們才往這方向去研究
1,因此就防疫來說
1,因此座談後便積極展開協調
1,因此建議增設研究組
1,因此當前的語音辨識技術
1,因為不能說的秘密
1,因為人潮移動而產生問題
1,因為包袱越來越大了
1,因為合約的問題
1,因為太冷就自己關機了
1,因為害怕就不敢想像
1,因為居住在不同縣市
1,因為常常寫出來的東西
1,因為年金改革
1,因為懶得開而直接印出來
1,因為我也吃不下了
1,因為我們只有一個地球
1,因為我們在同一家店買衣服
1,因為我們標榜全國會議
1,因為我有時發文也是這名稱
1,因為政治因素被攻擊
1,因為早有同好寫了很多
1,因為是塑膠的人工皮
1,因為是我才能達成
1,因為時間也快到了
1,因為最重要還是有關的部分
1,因為有些議題要事先研究
1,因為有兩張票
1,因為有前、中、後三層
1,因為有在主流媒體上看到科學界的記者會
1,因為有很多有趣的小店
1,因為母鯊大，所以公鯊小
1,因為民間是使用消費者
1,因為沒有完整版被罵得好兇唷
1,因為看了試閱版本
1,因為許多人都病了沒藥醫
1,因為說我做了
1,因為負責的工作性質不同
1,因為這台機器
1,因為還是人要使用的
1,因為都中小企業？
1,因為都屬於大家
1,因為都有壓力跟流速
1,因為陸客不來了
1,因為頻道不是開放式
1,因禍得福巧克力
1,因禍德芙巧克力
1,因總統也參加
1,因而深受感動
1,困擾著所有家庭
1,困難不會自動消失
1,困難的原因是？
1,困難與挑戰是激發我們的原動力
1,固有族群語言的各個腔調
1,國中課本介紹愛情的完整畫面
1,國土保育
1,國外日本、美國都大同小異
1,國外有學說認為事涉專業
1,國外的居多
1,國安局的便衣
1,國安的便衣
1,國家不會因為領導人而偉大
1,國家語言發展法
1,國有土地不參與信託
1,國有土地參與更新後
1,國有地參與都更
1,國泰世紀產物保險
1,國泰世華商業銀行
1,國稅局服務科
1,國立中央圖書館
1,國軍全面動員救災
1,國際合作不再只是政府與政府的協定
1,國際會議廳最多可以容納多少人？
1,國際社會不可或缺的夥伴
1,國際社會表達的關心和慰問
1,國際經貿合作及規則制定
1,園區場地使用收費標準
1,圓周率是三點一四一五九二六
1,圖林測試
1,團結一致才不會倒下
1,團結是為了改變
1,團隊也代表臺灣
1,團隊辛苦了！
1,土地不參與信託
1,土地所在地
1,土地無法使用者
1,土地的有效利用
1,土地處理方式
1,土城區頂福里
1,在一個學期後搜集發生的問題
1,在一百零八年上線
1,在一百零六年八月份
1,在一週內提出計畫
1,在七度的低溫中去瀑布祈願
1,在三創數位生活園區五樓
1,在三年前就職時曾說
1,在下水道來回檢測
1,在下水道來回測試
1,在不影響都市計劃的前提下
1,在不知不覺中教了一個殺人魔
1,在不知不覺間被人與物的關係所取代
1,在不經意間
1,在世界重新思考政府治理的此時
1,在二十多天的過程中
1,在二號出口
1,在二零一零年就通過了
1,在人生有重大轉折之際
1,在人道救援上
1,在什麼樣的情況下
1,在今年十月召開司法國是會議
1,在他的要求之下
1,在保障民眾個資的前提下
1,在做帽子的工廠工作
1,在兩性圓舞曲章節
1,在公平正義的議題上
1,在公開的網購平臺下標
1,在共同的價值基礎上
1,在前人的基礎上
1,在加拿大時
1,在加油站消費
1,在十三歲時
1,在協作中解決了問題
1,在去世的一年後
1,在去年首次舉辦的黑客松中
1,在友誼的基礎之上也要有紀律
1,在另外一個畫面
1,在台北不好求生
1,在台北有工作已經算不錯的了
1,在台灣反之亦然
1,在台灣從來沒看過
1,在台灣排隊等待
1,在哪裡
1,在哪裡跌倒，就在哪裡躺下來
1,在哺乳室內
1,在唱國歌之前
1,在回去的路上
1,在國小的教材裡就有提到
1,在城市交流的層面
1,在城市及國家治理上
1,在基礎建設方面
1,在報告書中加以說明
1,在墓碑刻下這一首詩
1,在外交與全球性的議題上
1,在外面吃完就沒事
1,在天願作比翼鳥，大難臨頭各自飛
1,在女嬰幾個月大時
1,在她六十歲時
1,在娘家吃飯
1,在子女就學後
1,在實習和體驗方面
1,在巷口吃完晚餐再回家
1,在市場擁有壟斷應用的企業或組織
1,在市場裡面
1,在年金的改革方面
1,在幾任政府的努力之下
1,在後續過程中仍會有變動的可能性
1,在復健及照護都可應用
1,在我們共同奮鬥的過程中
1,在我們這一代人的手上
1,在我感覺起來非常準確的時間
1,在我腦海之中
1,在我高一時，她同意了
1,在我高中畢業時
1,在手臂上貼了一個春字的刺青貼紙
1,在捷運上的兩扇門之間
1,在整個全國的結構上
1,在整個案子當中
1,在數位工具的輔助下
1,在既有的基礎上
1,在既有的政治基礎上
1,在日本吃到的福島柿餅還有草莓
1,在日本求學期間
1,在日落之前完成
1,在星期五早上
1,在時效内未提出
1,在書店看書打發時間
1,在有限的畫面安排眾多人物
1,在木櫃子上
1,在未來的任期之內
1,在機場找了一段時間
1,在歐亞板塊與菲律賓海板塊的相互碰撞中
1,在此代表表示歡迎之意
1,在此提醒大家團隊第一
1,在沒有到終局判決之前
1,在沙漠之中的甘泉也被飲盡
1,在法國大革命期間
