1,ａｉｔ是很敏感的建築物
1,ｆｂ粉絲專頁
1,google下去
1,一下子就逛完了
1,一九九二年
1,一九九六年
1,一九八七年
1,一二三四五，這樣嗎？
1,一二三地號範圍內的四五六地號
1,一些女生腳上套魚類造型潛水蛙鞋
1,一人一句
1,一人一萬日元
1,一人以上五人以下
1,一人做事一人擔，貞子做事甄子丹
1,一人做事一人擔，鹿特做事鹿特丹
1,一人做事一人當
1,一人做事一人當，小叮做事小叮噹
1,一人做事一人當，薏仁做事薏仁湯
1,一人做事薏仁湯
1,一位小姐跑來
1,一來是要解鎖手機
1,一個下午就買了三本書
1,一個中國人
1,一個人住的我
1,一個人差不多三十分鐘左右
1,一個人生日
1,一個個下去
1,一個化學系學生的關係
1,一個國家的年輕人沒有未來
1,一個小姐跑上來
1,一個正面迎向一切挑戰的新政府
1,一個結論
1,一個蔥花麵包都要二十塊了！
1,一元復始，雙喜臨門，四海遊龍，八方雲集
1,一兩次早就習慣了
1,一六五也解釋過了
1,一切又充滿了希望
1,一切安頓完成
1,一切為市民著想
1,一切突然安靜下來
1,一切都像是重新開始
1,一切都只是謠言
1,一切都在加速進行
1,一切都妥當惹拉
1,一切都歸零了
1,一則訊息在社群網站上的傳播模式
1,一加一等於二。
1,一包四塊台幣
1,一半的使用者
1,一堆人下車
1,一堆人在上通識課
1,一堆韓國人
1,一夕變化
1,一夜轉變
1,一大早就吃到垃圾早餐
1,一定ipad溫開水
1,一定可以擺脫困境
1,一定想辦法先湊點錢
1,一定會出手相救
1,一定會透過合法程序解決
1,一定有什麼過人的地方
1,一定要堅持到底！
1,一定要想個辦法
1,一定要趕快振作起來
1,一定要遠離市區
1,一定要配溫開水
1,一定還在某個地方
1,一家人都生活在恐懼之中
1,一家子選擇從頭開始
1,一家搬往台北蘆洲
1,一家烤肉萬家香
1,一對日本情侶也搭錯車
1,一山還有一山高，蘿蔔還有蘿蔔糕
1,一年之內
1,一年只有一天
1,一年見面的次數不到十次
1,一座國家公園
1,一手拿手機一手拿錢還真的很卡
1,一旦法院判決
1,一早六點就起床
1,一昧地說都是別人的錯
1,一時之間說不出話
1,一月十六日
1,一服用就能恢復健康
1,一朝被蛇咬，處處聞啼鳥
1,一杯才台幣五十
1,一杯才台幣六十五
1,一枚又大又圓的銀幣
1,一棟房不過十二三萬
1,一樓二樓都有置物櫃
1,一樓當倉庫用
1,一樣的局長做出不一樣的成績
1,一次安裝
1,一次次的徘徊
1,一次次的結束
1,一步一步有了家
1,一步一腳印展現成果
1,一段五百號
1,一段關係中到底少了什麼
1,一比一比鴨鴨，一比一比根號二
1,一滴治病，兩滴救命，三滴要你命
1,一番折騰後她回到家裡
1,一百一十八點一百六十八
1,一百七十二點二
1,一百六十個披薩
1,一百四十點一百一十二
1,一百零七年九月十一日
1,一百零七年度
1,一百零八年
1,一百零六年八月份
1,一百零六年時會上線
1,一盒八百八
1,一直到了前兩天
1,一直到了前兩天我才知道
1,一直愛你是我的驕傲，丟了你我怎麼炫耀
1,一直是不可或缺的關鍵角色
1,一直聽到在講肉覺得好餓
1,一直覺得文筆不錯
1,一直逼車
1,一看就知道我拍照的技術比較好
1,一瞬間我明瞭了
1,一瞬間進入夢境
1,一碗不便宜要三百日圓
1,一秒激怒義大利人
1,一種不願提起的想法
1,一種跟大家共襄盛舉的感覺
1,一篇亂七八糟的外傳
1,一篇文章隨機取三句
1,一至二月會再提出一些精進修改
1,一般上班族的午餐時間
1,一般人應該都不陌生
1,一般使用時很難重建這個問題
1,一般性法規沙盒的機制
1,一般民眾不會接到電話唷
1,一見鍾情，二見傾心，三件八五折
1,一見鐘情，二見傾心，三件七五折
1,一言驚醒洛克人
1,一起來催生這個新模式
1,一起來大啖語音應用
1,一起加入討論
1,一起去沖繩
1,一起把國家帶向新的方向
1,一起推動司法改革
1,一起查證謠言
1,一起準備了晚餐
1,一起聚集與交流
1,一路上他不再出聲
1,一路超冷才對
1,一輩子那麼長，等你幾年算什麼？
1,一道花生醬吐司，可以有多種組合
1,一邊幫忙店裡的買賣
1,一針一線
1,一開始以為來了
1,一開始帶風向「膨風」太厲害
1,一開始我是贏錢的
1,一間公司變好
1,一陣天旋地轉
1,一陣子沒看到妳
1,一陣車聲傳來
1,一零八年第一期
1,一顆開花，一顆結果
1,一點都沒有代表對方有比你多好
1,一點都沒有該有的禮貌
1,丁丁做事叮叮噹，麥當做事麥當當
1,七天就會到家了
1,七天等於一週
1,七彩泡泡般的輕薄夢幻
1,七星主峰更勝東峰
1,七月會成立工作小組
1,三位副市長及秘書長
1,三十八年的公務生涯
1,三十點五天約莫一個月
1,三合院內的婆媳戰爭
1,三大行業
1,三天之後他又來到那裡
1,三峽祖師廟
1,三年來陸續出現各式變種
1,三年才能繞台灣一圈
1,三月份會進行第二次驗證
1,三月的第二個週六
1,三番兩次的去
1,三輪車駛過的聲音
1,三重區
1,三零七是台北公車之王
1,三鶯工務所之公告處所
1,三鶯線捷運系統
1,上一次的五十年年都市計畫是一九三零年訂的
1,上上下下的樓梯
1,上上次跟我同房間的
1,上人下人慈濟人
1,上任之初
1,上個月在台北書展
1,上傳可以暫停嗎？
1,上午出席計畫記者會
1,上吧，外旋發球
1,上次有幾個教授來
1,上次買的牛奶快喝完了
1,上班好同事，下班不認識
1,上述六點請妥為準備
1,上週在報紙上
1,上週缺課
1,上週開始跑健身房
1,上面兩句也可以列入資料庫中
1,上面印著永續發展目標
1,上面這一句也可以
1,上面還要架網路設備
1,上面那一句話說的沒錯
1,上面那個包含個資
1,下一個明天
1,下一班要等六十分鐘
1,下不為例炸醬麵
1,下午大約六點半到台北
1,下午就會先去訪視
1,下大雨
1,下次像這樣的公開會議就是聽證
1,下次再根據功能考量
1,下次或散會後再由執行秘書整理
1,下次會議請董事長督導
1,下次給我注意一點！
1,下班一有空
1,下班公車要等四十分鐘
1,下稅後的事情
1,下車後我看了看錶
1,下載期限
1,下載的速度好慢
1,下週你那時有空
1,下週開始執行
1,下雨地上有水
1,下雨天了怎麼辦我沒帶雨傘
1,下雪天堆雪人
1,下面是山谷
1,下面遇到類似狀況時
1,不一定是名山大河
1,不一定會站在我們這邊
1,不久生下了女兒
1,不代表課本鼓吹
1,不以自有或承租農地為必要
1,不但將會變得無足輕重
1,不做又不行
1,不停從她臉頰滑落
1,不停重複這句話
1,不傷害任何人的原則
1,不僅是在臺北市
1,不僅是綜所稅申報而已
1,不僅無補於科學
1,不像我們那麼平凡
1,不像昔日為了討他喜歡
1,不再只是政府與政府的協定
1,不再只是法律人的司法
1,不再收音訊而是收類比訊號
1,不再是分裂的原因
1,不再是謊話連篇的社會
1,不再是遙不可及的事
1,不再獨自徬惶
1,不分你我
1,不利於修改
1,不到一萬個
1,不刺激、不示弱、不動氣
1,不動產估價報告
1,不去和他們聊天嗎？
1,不去米蘭去宜蘭
1,不受著作財產權保護
1,不只因為騎樓很熱鬧有機車
1,不只是單純憑著一股氣
1,不只是管理
1,不只降低了民主的門檻
1,不可以
1,不可多得的景觀城市
1,不可能因為換人當
1,不可能是他們
1,不合理之差別待遇
1,不合理的部分會將它過濾掉
1,不同價值觀的對話
1,不同再拆算
1,不同意信託費用
1,不同語言、腔調、性別、年齡的聲音
1,不同階層、不同職業代表
1,不同階段所停留過的地方
1,不同頻道有不同的目的
1,不在了還是很堅強
1,不在此限
1,不在這裡會在哪裡啊？
1,不堪之虐待
1,不太一樣
1,不太對啊！
1,不太確定你講的是哪個
1,不太符合我的用途
1,不好說，不好說阿
1,不如把工作辭掉
1,不安、矛盾、與對立
1,不容易使用
1,不寒蟬的訊息
1,不少人在讀過紅樓夢後
1,不就是你害的
1,不就繼續幫忙說廢話嗎？
1,不差這個
1,不常流淚的眼睛
1,不幫他們紀錄
1,不幸事件發生的時候
1,不得不說這整個服務是給人不少的挫折
1,不得以倉皇逃到台北
1,不得以逃到台北
1,不得低於百分之八十五
1,不得收取費用
1,不得聲請憲法解釋
1,不必跟著早餐晚餐一起
1,不想踏入廚房
1,不應有感情色彩和私人成分
1,不應理所當然
1,不打算生孩子
1,不敢當！
1,不敢評論中央的外交政策
1,不料好景不常
1,不斷傳達蜘蛛人堅持的信念
1,不斷在改進當中
1,不斷地讓人與機器互相學習
1,不斷自我挑戰
1,不斷與外界互動
1,不斷衝擊我們的信念
1,不是不爆，十秒未到
1,不是全部人說的都是對的
1,不是再幾天就回來了？
1,不是只有臺北市可以解決
1,不是啊
1,不是指記者和媒體從業人員的素養
1,不是智商多高就會擁有智慧
1,不是發生在臺灣的就是臺灣價值
1,不是真皮的就是有這個壞處！
1,不是穩中求變的團隊
1,不是著作權所有人
1,不是要驗證
1,不是讓你拿來玩的
1,不是資本主義邏輯
1,不時拍拍她
1,不會傷害身體的方法
1,不會刁難也不會放水
1,不會啦！
1,不會因此滑倒
1,不會影響到他們的壓力測試
1,不會有人一出生就想要做壞事
1,不會有什麼事的
1,不會有很突兀的轉折
1,不會有財政經營的問題
1,不會生活，你就沒有人生
1,不會破壞語音資料
1,不會賺得比老闆多
1,不會透漏他們的位置
1,不服來辯
1,不服滾之類的
1,不滿政院如此草率回覆
1,不然下午就喝不到囉
1,不然任何著作都可以了吧
1,不然就找人問
1,不然就都沒說
1,不然的話就會顯得很幼稚
1,不然肯定骨折
1,不照相、不堵麥、不接受訪問
1,不特別說以為台灣四季都是夏天呢
1,不用場地費耶
1,不用擔心說已經吃東西了沒
1,不用解鎖手機啊
1,不當應用於非經授權之範圍
1,不知走去哪玩啊
1,不知道作何感想
1,不知道公車怎麼搭
1,不知道在找什麼
1,不知道多久以前的事情了
1,不知道它們在哪裡
1,不知道怎麼把他拉來
1,不知道是什麼味道
1,不知道為何陷入孤獨
1,不知道的卻還一直生
1,不知道究竟要什麼
1,不知道美國以外的組織能不能申請
1,不知道耶
1,不知道能不能用來設計？
1,不知道自己的感受
1,不知道花了多少錢
1,不知道要準備什麼東西
1,不知道要開拍了
1,不知道賠多少
1,不確定有沒有更適合的地方放
1,不確定的就等著繳錢
1,不確定的目標在何方
1,不確定這是甚麼意思
1,不符合目前價值觀的行為舉止
1,不考慮別人的感受
1,不能先解救自己，那就更不可能去解救別人
1,不能再任意切割
1,不能和他們正面衝突
1,不能回復原狀
1,不能夠適應改變的人
1,不能完全讓它變成自由市場
1,不能將所有問題丟到該處
1,不能殺掉這些人
1,不能每年換車
1,不能直接跟藍芽裝置配對
1,不能給孩子好一點的東西
1,不能與聯合國安全理事會相比喻
1,不能讓你進來
1,不能這樣處理
1,不能隨便灑骨灰到海裡
1,不良生態與不合適的法律
1,不行，不能放棄
1,不行啦這個
1,不行，那裡不行
1,不被人民信任
1,不被時代潮流所淘汰
1,不被自己的命運迷惑
1,不要以年曆的方式設計
1,不要以書面的邏輯來設計介面
1,不要再打了
1,不要動，再動我不保證會發生什麼
1,不要只是召開冗長的形式會議
1,不要問為什麼沒有人做這個
1,不要彈出不安全警告的技術
1,不要待在這裡
1,不要忘了有兩種路線
1,不要忘記對環境的責任
1,不要急著搶麥克風
1,不要把家裡的怨氣帶到公司
1,不要把難做的事都安排給我
1,不要把骨灰灑在迪士尼樂園
1,不要操作雨刷
1,不要擔心啦
1,不要求民眾進入技術的空間
1,不要演變成内部的分裂
1,不要為了程序問題
1,不要老是在官方非官方的問題上打轉
1,不要背課文了
1,不要被發現
1,不要隨便相信網路上的消息
1,不論他做的是什麼工作
1,不論從什麼角度出發
1,不論是在朝或在野的
1,不論發生什麼事
1,不買，明年過父親節
1,不過一個政府不能永遠在震驚
1,不過也因為這些對立
1,不過人類的骨頭結構是哺乳動物
1,不過就是從一堆資訊中拼湊出來
1,不過就是有及時完成夢想的能力
1,不過很遺憾的是
1,不過我印象中
1,不過我想大概很難形容
1,不過我覺得
1,不過我覺得，整個籌備工作
1,不過文字太艱深
1,不過正如同
1,不過這不失為一個機會教育的好機會
1,不開放團體預約
1,不需要讓使用者進行
1,不願意不得不
1,不顧北京反對
1,且保持自己的體力
1,且出現不適切言語
1,且可以增加員工的激勵獎金
1,且可以增加員工的激勵獎金、績效獎金
1,且對會議進行或許有所幫肋
1,且未來若進行工程需先討論
1,且給他們類似永久教授的職位
1,且經過長時間的調校
1,世上只有媽媽好，有媽的孩子像漢堡
1,世代之間時常意見相左
1,世界上其他國家一樣
1,世界上最有公信力的獎
1,世界上第二有公信力的
1,世界平靜祥和
1,世界越快尖頭鰻
1,世界雖小，武漢肺炎
1,丟了好幾次被要求修正
1,丟兩百萬噸柚子的事情
1,並不一定是背後有經濟勢力在資助
1,並不是單純事實報導
1,並不是戰鬥力破表的神獸
1,並不是指記者和媒體從業人員的素養
1,並不是經常性改版
1,並不會
1,並不會改變大眾的使用習慣
1,並不涉及政治
1,並不覺得這些是爭議
1,並且今年三月也有新聞指出
1,並且克服種種不確定因素
1,並且有意識地去改善一段關係
1,並且清楚說明
1,並且融入
1,並且邀請孩子說說看
1,並且配合經營者的利益
1,並做出行動
1,並做為結語
1,並免收裝機費及基本頻道收視費
1,並在這個既有的事實
1,並存於臺灣社會
1,並帶動法規創新
1,並投入討論
1,並授權給搜尋引擎使用
1,並提供網頁版
1,並提示完成百分比
1,並未詳細討論
1,並用副本通知說明
1,並給予實質回饋
1,並設立國際組織
1,並進入不適任處理流程
1,並進行數位化及網站建置
1,中午都逛完了才找到
1,中和區員山公園旁
1,中國人在等車
1,中國人說還要十幾分鐘
1,中國危害國安
1,中國有自由和民主
1,中國評論通訊社
1,中天只要不要翻拍就不侵權了
1,中天大量報導韓國瑜後
1,中天新聞派出的人
1,中央圖書館
1,中央山脈的另一邊
1,中央廣播電台音樂網
1,中央政府總預算視覺化
1,中央目的事業主管機關查核
1,中央研究院資訊所
1,中央與地方
1,中山路一段一百六十號
1,中庄國中教師
1,中心會處理
1,中研院資訊所
1,中研院預告
1,中華人民共和國是美好的世界
1,中華民國
1,中華民國人口福利部
1,中華民國國民
1,中華民國現行憲政體制
1,中華電信澄清過囉
1,中華電信表示
1,中陷阱死翹翹
1,中風後還需要柺杖幫助走路
1,主動善盡告知義務
1,主動走進去也未嘗不可
1,主動開放空間給災民使用
1,主席副主席
1,主席請各位表達意見
1,主張應站在人民的立場思考
1,主打天然洗沐用品的企業
1,主管都在立法院開會
1,主要概念就是
1,主要概念就是要
1,主要目標是
1,主辦單位保留權力
1,乃至於「異性戀霸權」
1,久了之後其實會發現
1,之前受傷坐輪椅後
1,之前有看過其他產品
1,之前欠的錢還沒還完
1,之後你們自己要小心
1,之後就沒有了
1,之後會定期透過語音更新資訊
1,之後記得發訊息
1,乖乖待在房裡寫功課
1,乖孫啊
1,乖，很快就沒事了
1,乘坐汽車而不是轎子
1,九二年之後
1,九十八之七號
1,九十日幣
1,九層塔滑湯灑湯燙塔
1,也不只是司法人的家務事
1,也不可以躁進
1,也不想想家裡的人還沒吃飯
1,也不應該完全無視少數的權益
1,也不會在乎要消滅自己的國家
1,也不會貴多少啊
1,也不能再像過去
1,也並未證實為同性戀者
1,也來等車
1,也別忘了聽聽別人錄的
1,也加入蔥花
1,也只有一票直銷的東西
1,也可以和食物一起服用
1,也可以寫文
1,也可以將自己的手機條碼印出來
1,也可以拿來用
1,也可以靜音模式偷偷摸摸埋伏
1,也可提供給規劃單位做參考
1,也可直接變成普通藍芽無線耳機
1,也吸引不少合作對象
1,也因此在意外發生時無人發現
1,也太便宜，明天就去看看好了
1,也太冷清了
1,也寧願永遠作夢
1,也就是以此類推
1,也就是剛剛說的
1,也就是讓用戶感覺放心
1,也已經移植到國外
1,也希望大家一起思考
1,也很難即時發現新的漏水點
1,也必須跟隨民意浪潮
1,也打入國際市場
1,也承包外面的案子
1,也拜託大家用這個態度
1,也放聲大哭
1,也是一個決心的宣誓作為
1,也是一個社會總動員的過程
1,也是一種台北霸權的展現
1,也是公部門與民眾的溝通橋樑
1,也是希望保護這些和別人不一樣的孩子
1,也是我人生中的新體驗
1,也是臺灣電影人的家
1,也會將使用者資料作為產品
1,也有介紹與異性的相處
1,也有以色列公司開發商用的解決方案
1,也有個幾十萬跑不掉吧
1,也有商用的解決方案
1,也有奶精版跟鮮奶版
1,也有很多解決克服的方法
1,也有很密切的關係
1,也有溝通能力
1,也有空襲以及戰亂
1,也歡迎你
1,也歡迎你加入熱心人行列
1,也歡迎把你新收到的謠言送進資料庫
1,也歡迎讓我們知道
1,也沒什麼事情
1,也沒什麼效果
1,也沒有人能肯定是同性戀
1,也沒有什麼三千元啦
1,也沒有把握
1,也沒那麼聳動
1,也添加了自動翻譯的功能
1,也發現一些問題
1,也算是來過工寮最大咖的人物了
1,也經由中研院史語所等單位協力採集
1,也能藉由輿論力量予以化解
1,也要保留一些掌聲
1,也要讓世界走進臺灣
1,也要陪你一起加班
1,也親了我
1,也許是因為害怕
1,也許是因為後悔
1,也認真討論未婚懷孕的狀況
1,也請跟我們一起
1,也變得越來越複雜
1,也造就了亞洲最開放自由的公民社會
1,也還是可以討論
1,也都是好孩子
1,也開始思考
1,也離她而去
1,也難以相遇
1,也需要地方政府
1,乳不巨何以聚人心
1,乳不巨，何以聚人心？
1,乾柿子挑軟的
1,了不起，負責
1,了解所有事物的真相
1,了解更多情況
1,予以討論
1,事前同意或事後饒恕
1,事實上也一直朝這個方向
1,事實上是一個有很多細節性的工作
1,事實上這並沒有爭議
1,事後她得知
1,事情多起來就容易亂
1,事情成功馬上說自己也有功勞
1,事情終究還沒解決
1,事業單位
1,事發後立即記申誡一次
1,二三零年代
1,二兒子抽菸、酗酒
1,二兒子真厲害
1,二十一世紀的新型態公民協力與對話
1,二十四小時等於一天
1,二十四歲時化療插管
1,二十多年來
1,二十幾萬不用了
1,二月多倫多是不是冷爆了？
1,二樓以上平均單價約為每坪八十七萬元
1,二樓以上租金水準
1,二段一百二十三之四號
1,二話不說拉住她的手往回走
1,二零一三年
1,二零一二年
1,互為表裡
1,互相做審查的工作
1,互負同居之義務
1,五代十國父紀念館
1,五十九點一百二十
1,五十二萬七千多字全部寫在竹簡上
1,五十二點一四二八五七週約為一年
1,五十歲時中風前
1,五大創新研發計畫
1,五巷三十六號
1,五年級健康與體育
1,五月中才能參觀
1,五月先去高雄玩再去台南逛啊
1,五股區五股國民小學
1,亞太地區的安全情勢
1,亞太經貿重鎮
1,亞洲乃至亞太區域國家
1,交到下一個世代手上
1,交在新政府身上
1,交接社會企業相關業務
1,交給有關團體表示意見
1,交通、治安及消防整備
1,交通、環保及治安
1,交通發達
1,交通館有講倫敦設計的專區
1,交錯的機會雖然不多
1,亦可於之後再做
1,亦或自作多情
1,享有一個不怕失敗的環境
1,京都關西美術學院洋畫科
1,人事上完全不變的機構是化石
1,人事行政局或主計處
1,人力的調度
1,人力相當於編制
1,人因廢話而生
1,人在曹營心在漢
1,人家看的就是不一樣
1,人家說給他魚吃，不如教他釣魚
1,人工智慧程式寫出來的文章
1,人性中最美的那一面
1,人才與市場
1,人數分配上各一半
1,人數是一個政策性的決定
1,人數與第五至六頁的人數不一致
1,人旺財旺歐比王，納福納吉安納金
1,人最多那天直接定下來
1,人本教育基金會
1,人格尊嚴與價值
1,人比人氣死人，蛋餅比蛋餅起司蛋餅
1,人比人氣死人，蛋餅比蛋餅，起司蛋餅
1,人民選擇了新總統
1,人潮依然低落
1,人生三大錯覺
1,人生不就是這樣，起起落落落落落
1,人生嘛，何必呢
1,人生如戲，全靠演技
1,人生就像當詐騙集團一樣
1,人生就是一個人的生活
1,人生就是起起落落，並且祈禱機長不要出差錯
1,人生最重要的事
1,人生會背叛你，但數學不會，不會就是不會
1,人生短短幾個秋
1,人生自古誰無死，不如乾脆就去死
1,人生自古誰無死，我死不如你去死
1,人群裡有雙明亮的眼睛
1,人與人的關係
1,人若回頭，不是掉錢就是被叫帥哥
1,人資小周末創辦人
1,人造器官當然搶手
1,人道救援
1,人非聖賢，豬哥難免
1,人類在水中要學美人魚
1,人類大腦將環境化繁為簡的歸納能力
1,人類建立屠宰場
1,人類比他們想像中友善
1,人類生活和社會狀況
1,人類的工作機會將被取代？
1,人類的溝通只有單向的宣達
1,人類聚集居住的地方
1,人體研究倫理審查委員會
1,什麼人來了？
1,什麼叫木馬屠城
1,什麼是黑客松呢？
1,今天上課錄影晚點上傳
1,今天下午打電話來
1,今天中午難得拿到遙控器
1,今天也一樣不順
1,今天也提出一份
1,今天來就是來看看
1,今天先討論議題
1,今天去浮潛
1,今天參加邪教聚會
1,今天又有人切掉了？
1,今天可直接進入議題的討論
1,今天喝到麥當勞
1,今天國小畢業
1,今天圖書館休館
1,今天將這句話送給大家
1,今天弟弟給你接
1,今天從南屯騎車到彰化和美
1,今天忘記帶錢出門
1,今天想跟各位分享
1,今天想跟各位分享一則賴上面流傳
1,今天我們家
1,今天我們開全國司法改革籌備會
1,今天我站在這裡
1,今天手遊大更新
1,今天早上還以為點到無糖奶茶
1,今天明天
1,今天是三一八公民運動五週年
1,今天是用腳玩魔術方塊
1,今天是補救動作
1,今天是除夕
1,今天晚上晚點回去
1,今天晚上有宴會
1,今天曬一下
1,今天會有這些問題
1,今天有個消息
1,今天有太陽，好一點
1,今天決定人數分配比率
1,今天活動開始囉！
1,今天的七星山讚
1,今天的國際合作
1,今天的就職典禮
1,今天的演說是一個邀請
1,今天的進度務必確實複習
1,今天突然沒什麼梗
1,今天第一次籌備會議
1,今天給它徹底脫皮一次
1,今天與會的人員
1,今天謝謝各位的參加
1,今天跑去吃
1,今年也與數位時代合作
1,今年五月底
1,今年即將舉辦第二屆
1,今年四月起
1,今年年初發生的問題
1,今年所有的活動都結束啦
1,今年施行的戰略計畫
1,今日我們受人點滴
1,今日的現代創作
1,今日能否提出名單？
1,今日隆重登場
1,今晚要在哪裡過夜
1,今晚遇到台南拍飛機的好地方
1,介入之人數不可太多
1,介面上如何規劃並優化
1,仍可再要求學校釐清
1,仍念念不忘你的身影
1,仍是三十年前
1,仍然偏重於主流語言
1,仍要求教師參與相關輔導研習
1,仍須依相關規定辦理
1,仔細揣摩畫家的心境與技法
1,他一向都知道
1,他一定會買
1,他不可能答應的
1,他不時去摸摸她的頭
1,他也一樣深受感動
1,他也不是完全不念舊情的人
1,他以當地的國道為名
1,他們一定會有辦法的
1,他們不會救災
1,他們不管對象是誰
1,他們今天好像有約
1,他們來了！
1,他們做出專案
1,他們八十個人
1,他們八十個人一個個下去
1,他們去年結婚
1,他們可以做早餐
1,他們在村里擁有四五甲田
1,他們在那裡工作
1,他們將其改造為香草實驗室
1,他們就失業了嗎？
1,他們帶了一群人來了
1,他們心疼小兒子居無定所
1,他們才是一群最喪盡天良的人
1,他們才發現
1,他們搬辦公室要丟一大堆東西
1,他們暫時安頓下來
1,他們會來找我們
1,他們有效率的多
1,他們發現冬天沒有蟲子
1,他們的交情對他而言
1,他們的人生
1,他們的心像凍結成冰
1,他們的生意很順利
1,他們看起來真的很驚訝
1,他們聚在一起
1,他們衝進來了
1,他們要上山回飯店
1,他們說出席委員都在睡覺
1,他們還生了七個孩子
1,他們都倚恃著自己是醫生
1,他們都十分高興
1,他們都射一射就死了
1,他們都是專業人士
1,他們都疲憊不堪
1,他們都自以為是最聰明的一群人
1,他們默默地準備後事
1,他只接受你生給他更多
1,他只是站著沉默不語
1,他和她的表情都十分嚴厲
1,他喜歡我
1,他外出買東西
